4135,Iranian state-sponsored hacking group CyberAv3ngers compromised critical infrastructure in Israel and the United States using IOCONTROL malware beginning in mid-October 2023,"In late 2023 and mid-2024, Iranian threat actors, specifically the CyberAv3ngers group, used a new malware named IOCONTROL to compromise Internet of Things (IoT) devices and OT/SCADA systems in Israel and the United States, Claroty's Team82 reported on December 10, 2024. The targeted devices included routers, programmable logic controllers (PLCs), human-machine interfaces (HMIs), IP cameras, firewalls, and fuel management systems from various manufacturers, including D-Link, Hikvision, Baicells, Red Lion, Orpak, Phoenix Contact, Teltonika, and Unitronics. 
On October 14, 2024, the threat actors claimed to have compromised 200 gas stations in Israel and the U.S. on Telegram, which aligns with Claroty's findings. Claroty's Team82 confirmed that the threat actors compromised several hundred Israeli-made Orpak systems and U.S.-made Gasyboy fuel management systems. This happened in one go from mid-October 2023 to January 2024 until they resumed their attack from July to August 2024.",14.10.2023,Not available,"Attack conducted by non-state group / non-state actor with political goals (religious, ethnic, etc. groups) / undefined actor with political goals;Attack on critical infrastructure target(s)","Attack conducted by a state-affiliated group (includes state-sanctioned, state-supported, state-controlled but officially non-state actors) (“cyber-proxies”) / a group that is generally attributed as state-affiliated ;Not available",Incident disclosed by IT-security company,Hijacking without Misuse,Not available;Not available,Israel;United States,IL;US,"['ASIA', 'MENA', 'MEA'];['NATO', 'NORTHAM']",Critical infrastructure;Critical infrastructure,Energy;Energy,Cyber Avengers/Cyber Av3ngers < Storm-0784/Shahid Kaveh Group (IRGC-CEC),"Iran, Islamic Republic of",IR,State affiliated actor,Not available,1,25254,10.12.2024,"Technical report (e.g., by IT-companies, Citizen Lab, EFF)",IT-security community attributes attacker,Claroty's Team82,Claroty's Team82,United States,True,"Iran, Islamic Republic of",State affiliated actor,https://claroty.com/team82/research/inside-a-new-ot-iot-cyber-weapon-iocontrol,International power,International power,Iran – Israel,Yes / HIIK intensity,HIIK 4,0,Not available;Not available,Not available;Not available,Not available;Not available,Israel;United States,Not available;Not available,Unknown,Not available,Not available,Not available,Not available,False,Not available,Not available,"Hijacking, not used - empowerment (incident scores 1 point in intensity)",none,none,1,Moderate - high political importance,1,Low,10,Months,No data breach/exfiltration or data corruption (deletion/altering) and/or leaking of data,11-50,0,1-10,2,None,0,euro,Indirect (knowingly sanctioning / ordering / ideological / material support by official members of state entities/agencies/units for officially non-state-actors),Sovereignty,Not available,Not available,0,Not available,Not available,Not available,Not available,Not available,Not available,Not available,Countermeasures under international law justified (state-atttribution & breach of international law),Not available,https://www.bleepingcomputer.com/news/security/new-iocontrol-malware-used-in-critical-infrastructure-attacks/;https://claroty.com/team82/research/inside-a-new-ot-iot-cyber-weapon-iocontrol;https://securityaffairs.com/171980/malware/iocontrol-cyberweapon-targets-us-isreael.html;https://thehackernews.com/2024/12/iran-linked-iocontrol-malware-targets.html,2024-12-13,2025-03-03
4134,"Unknown threat actors breached Byte Federal by exploiting a GitLab vulnerability on November 18, 2024","On November 18, 2024, US Bitcoin ATM operator Byte Federal became aware that unknown threat actors gained access to one of their servers, exploiting a GitLab vulnerability, potentially compromising the personal information of 58,000 customers, including name, birthdate, address, phone number, email address, government-issued ID, social security number, transaction activity, and photographs of users. 
Byte Federal disclosed the data breach and responded by shutting down its platform, locking out the attacker, and securing the compromised server.",18.11.2024,18.11.2024,Attack on critical infrastructure target(s);Attack on critical infrastructure target(s),Not available;Not available,Incident disclosed by victim,Data theft;Hijacking with Misuse,Not available,United States,US,"['NATO', 'NORTHAM']",Critical infrastructure,Finance,Not attributed,Not attributed,Not attributed,Not attributed,Not available,1,25252,Not available,Not available,Not available,Not available,Not available,Not available,True,Not attributed,Not attributed,Not available,Not available,Not available,Not available,Not available,Not available,0,Not available,Not available,Not available,Not available,Not available,No,Not available,Exploit Public-Facing Application,Data Exfiltration,Not available,False,For private / commercial targets: sensitive information (incident scores 2 points in intensity),Not available,"Hijacking, system misuse, e.g., through data theft and / or disruption (incident scores 2 points in intensity)",none,none,4,Moderate - high political importance,4,Low,9,Days (< 7 days),"Data corruption (deletion/altering) but no leaking of data, no data breach/exfiltration OR major data breach / exfiltration, but no data corruption and/or leaking of data",1-10,1,1-10,1,None,0,euro,Not available,Human rights;Sovereignty,Civic / political rights;Not available,Not available,1,2024-11-27,"Other legal measures on national level (e.g. law enforcement investigations, arrests)",Not available,United States,Not available,Not available,Not available,Unfriendly acts/retorsions justified (missing state-attribution & breach ofinternational law OR state-attribution & missing breach of international law),Not available,https://securityaffairs.com/171941/data-breach/us-bitcoin-atm-operator-byte-federal-suffered-a-data-breach.html;https://www.bleepingcomputer.com/news/security/bitcoin-atm-firm-byte-federal-hacked-via-gitlab-flaw-58k-users-exposed/;https://www.bytefederal.com/files/Consumer%20Breach%20Notification%20Letter.pdf,2024-12-13,2025-02-04
4132,Unknown Threat Actors Disrupted Online Ordering Operations Of Krispy Kreme In The United States By Breaching Its Information Technology Systems On 29 November 2024,"On 29 November 2024, unknown threat actors compromised the confidentiality and availability of Krispy Kreme's information technology systems, disrupting online ordering across the United States. Krispy Kreme, which operates 1,521 shops and 15,800 points of access, detected unauthorized activity and engaged leading cybersecurity experts to address the incident. The breach has materially impacted the company's operations, with anticipated financial losses due to reduced digital sales, fees for cybersecurity experts, and system restoration costs. The company's stock price dropped by 2% following the disclosure. Krispy Kreme revealed the attack in an SEC filing on 11 December 2024, along with an update on its website about operational disruptions. No ransomware groups have claimed responsibility, and the investigation remains ongoing with no timeline for recovery provided.",29.11.2024,Not available,Attack on critical infrastructure target(s),Not available,Incident disclosed by victim,Disruption;Hijacking with Misuse,Not available,United States,US,"['NATO', 'NORTHAM']",Critical infrastructure,Food,Not attributed,Not attributed,Not attributed,Not attributed,Not available,1,24817,Not available,Not available,Not available,Not available,Not available,Not available,True,Not attributed,Not attributed,Not available,Not available,Not available,Not available,Not available,Not available,0,Not available,Not available,Not available,Not available,Not available,Not available,Not available,Not available,Not available,Not available,True,Not available,Long-term disruption (> 24h; incident scores 2 points in intensity),"Hijacking, system misuse, e.g., through data theft and / or disruption (incident scores 2 points in intensity)",none,none,4,Moderate - high political importance,4,Low,8,Days (< 7 days),No data breach/exfiltration or data corruption (deletion/altering) and/or leaking of data,1-10,1,1-10,1,=< 10 Mio,0,euro,Not available,Sovereignty,Not available,Not available,0,Not available,Not available,Not available,Not available,Not available,Not available,Not available,Unfriendly acts/retorsions justified (missing state-attribution & breach ofinternational law OR state-attribution & missing breach of international law),Not available,https://www.bleepingcomputer.com/news/security/krispy-kreme-cyberattack-impacts-online-orders-and-operations/,2024-12-12,2025-01-09
4130,Unknown Threat Actors Stole Credentials of Employees of 30 Companies Across 12 Industries Worldwide Beginning in Early July 2024,"Beginning in at least July 2024, unknown threat actors launched a sophisticated global phishing campaign targeting employees of 30 companies across 12 industries, distributing over 200 malicious links designed to steal user login credentials, with stolen credentials sent to attackers in real time via C2 servers or Telegram bots. Cybersecurity researchers at Group-IB reported on 11 December 2024. 
The industries targeted in this phishing operation included Energy, Fashion, Finance, Aerospace, Manufacturing, Telecommunications, Government, IT, Healthcare, Technology, and Entertainment. 
This campaign was designed to bypass Secure Email Gateways (SEGs) and evade detection. In particular, the attackers used three main techniques to bypass email security: Trusted Domain Abuse, Dynamic Company Branding, Document Platform Impersonation. In the trusted domain abuse tactic, attackers embedded malicious URLs within legitimate services like Adobe.com and Google AMP, making it harder for security tools to detect. In document platform impersonation, fake DocuSign and Adobe notifications were used to lure users into clicking links for what seem to be important documents. Meanwhile, with dynamic company branding, phishing pages cleverly displayed the victims' company logo and branding by pulling them directly from legitimate websites. Users who clicked the malicious links were directed to convincing login pages pre-filled with their email addresses.",01.07.2024,Not available,"Attack on (inter alia) political target(s), not politicized;Attack on critical infrastructure target(s)",Not available;Not available,Incident disclosed by IT-security company,Data theft;Hijacking with Misuse,Not available;Not available;Not available;Not available;Not available;Not available;Not available;Not available;Not available;Not available;Not available;Not available;Not available;Not available;Not available;Not available;Not available;Not available;Not available,"Germany;Saudi Arabia;Iran, Islamic Republic of;Indonesia;Philippines;Chile;Italy;Portugal;Hungary;Slovenia;Taiwan;France;United Kingdom;United Kingdom;Vietnam;Vietnam;United States;United States;United States",DE;SA;IR;ID;PH;CL;IT;PT;HU;SI;TW;FR;GB;GB;VN;VN;US;US;US,"['EUROPE', 'NATO', 'EU', 'WESTEU'];['ASIA', 'MENA', 'MEA', 'GULFC'];['ASIA', 'MENA', 'MEA'];['ASIA', 'SCS', 'SEA'];['ASIA', 'SCS', 'SEA'];['SOUTHAM'];['EUROPE', 'NATO', 'EU'];['EUROPE', 'NATO', 'EU'];['EUROPE', 'NATO', 'EU', 'EASTEU'];['EUROPE', 'BALKANS', 'NATO', 'EU'];['ASIA', 'SCS'];['EUROPE', 'NATO', 'EU', 'WESTEU'];['EUROPE', 'NATO', 'NORTHEU'];['EUROPE', 'NATO', 'NORTHEU'];['ASIA', 'SCS', 'SEA'];['ASIA', 'SCS', 'SEA'];['NATO', 'NORTHAM'];['NATO', 'NORTHAM'];['NATO', 'NORTHAM']",Education;Corporate Targets (corporate targets only coded if the respective company is not part of the critical infrastructure definition);Corporate Targets (corporate targets only coded if the respective company is not part of the critical infrastructure definition);Corporate Targets (corporate targets only coded if the respective company is not part of the critical infrastructure definition);Critical infrastructure;State institutions / political system;Corporate Targets (corporate targets only coded if the respective company is not part of the critical infrastructure definition);State institutions / political system;State institutions / political system;Critical infrastructure;Corporate Targets (corporate targets only coded if the respective company is not part of the critical infrastructure definition);Critical infrastructure;State institutions / political system;Critical infrastructure;Critical infrastructure;Critical infrastructure;Critical infrastructure;Corporate Targets (corporate targets only coded if the respective company is not part of the critical infrastructure definition);Critical infrastructure,Not available;Not available;Not available;Not available;Energy;Government / ministries;Not available;Government / ministries;Government / ministries;Finance;Not available;Telecommunications;Government / ministries;Finance;Energy;Finance;Health;Not available;Space,Not attributed,Not attributed,Not attributed,Not attributed,Not available,1,24816,Not available,Not available,Not available,Not available,Not available,Not available,True,Not attributed,Not attributed,https://www.group-ib.com/blog/trust-hijacked/,Unknown,Unknown,Not available,Unknown,Not available,0,Not available,Not available,Not available,Not available,Not available,Not available,Not available,Phishing,Not available,Not available,False,For private / commercial targets: non-sensitive information (incident scores 1 point in intensity),Not available,"Hijacking, system misuse, e.g., through data theft and / or disruption (incident scores 2 points in intensity)",none,none,3,Moderate - high political importance,3,Medium,13,Weeks (< 4 weeks),"Data corruption (deletion/altering) but no leaking of data, no data breach/exfiltration OR major data breach / exfiltration, but no data corruption and/or leaking of data",51-200,0,Not available,0,None,0,euro,Not available,Cyber espionage;Human rights;International telecommunication law;Sovereignty,Non-state actors;Civic / political rights;Not available;Not available,Not available,0,Not available,Not available,Not available,Not available,Not available,Not available,Not available,Unfriendly acts/retorsions justified (missing state-attribution & breach ofinternational law OR state-attribution & missing breach of international law),Not available,https://hackread.com/ongoing-phishing-campaign-targets-employees/;https://www.group-ib.com/blog/trust-hijacked/,2024-12-12,2025-01-09
4129,Russian-Based Threat Actor Storm-1837 and Russian State-Sponsored Hacking Group Secret Blizzard (Also Known as Turla) Compromised Military-Related Devices in Ukraine in January 2024,"Since December 2023, Microsoft has been monitoring the activities of a Russian threat actor, Storm-1837 (overlapping with threat actors known as Flying Yeti and UAC-0149), targeting devices belonging to Ukrainian military drone operators. In January 2024, a Ukrainian military device was compromised using a Storm-1837 backdoor. The backdoor leveraged the Telegram API to execute a PowerShell cmdlet. This enabled connections to an account on the file-sharing platform Mega, likely for downloading files or commands. A PowerShell dropper observed on the device deployed two encoded files, delivering the Tavdig backdoor and a Symantec binary, enabling further reconnaissance. Secret Blizzard, another actor, used Tavdig to install the KazuarV2 backdoor for persistence and subsequent operations. Microsoft was still investigating whether Secret Blizzard leveraged access to Storm-1837's backdoor or purchased access, which would indicate cooperation. Microsoft assumed that Secret Blizzard likely wanted to exploit this access to gain further strategic access at the ministerial level. The background to this cyber incident was an incident published a week earlier in the first part of the report, which is also available here. In that incident, Secret Blizzard compromised the infrastructure of Pakistani threat actor Storm-0156 to gain access to Afghan government entities' computer systems.",01.12.2023,Not available,"Attack conducted by non-state group / non-state actor with political goals (religious, ethnic, etc. groups) / undefined actor with political goals;Attack on (inter alia) political target(s), not politicized","Attack conducted by a state-affiliated group (includes state-sanctioned, state-supported, state-controlled but officially non-state actors) (“cyber-proxies”) / a group that is generally attributed as state-affiliated ;Not available",Incident disclosed by IT-security company,Hijacking with Misuse,Not available,Ukraine,UA,"['EUROPE', 'EASTEU']",State institutions / political system,Military,"Turla/Waterbug/Venomous Bear/Snake/Uroburos/Group 88/Secret Blizzard fka KRYPTON/G0010/UAC-0003 (FSB Centre 16, Unit 71330);Storm-1837",Russia;Russia,RU;RU,State affiliated actor;Unknown,"Non-state-group, state-affiliation suggested (widely held view for the attributed initiator (group), but not invoked in this case);Not available",1,24815;24815,11.12.2024;11.12.2024,"Technical report (e.g., by IT-companies, Citizen Lab, EFF);Technical report (e.g., by IT-companies, Citizen Lab, EFF)",IT-security community attributes attacker;IT-security community attributes attacker,Microsoft;Microsoft,Microsoft Security Intelligence;Microsoft Security Intelligence,United States;United States,True;True,Russia;Russia,State affiliated actor;Unknown,https://www.microsoft.com/en-us/security/blog/2024/12/11/frequent-freeloader-part-ii-russian-actor-secret-blizzard-using-tools-of-other-groups-to-attack-ukraine/,International power,International power,Russia – Ukraine,Yes / HIIK intensity,HIIK 5,0,Not available,Not available,Not available,Not available,Not available,Not available,Not available,Not available,Data Manipulation,Not available,False,Not available,Not available,"Hijacking, system misuse, e.g., through data theft and / or disruption (incident scores 2 points in intensity)",none,none,2,"Very high political importance (e.g., critical infrastructure, military) - intensity multiplied by 1.5",3,Minor,5,No system interference/disruption,No data breach/exfiltration or data corruption (deletion/altering) and/or leaking of data,1-10,0,1-10,1,None,0,euro,Indirect (knowingly sanctioning / ordering / ideological / material support by official members of state entities/agencies/units for officially non-state-actors),Cyber espionage;Armed conflict;Sovereignty,Non-state actors;Conduct of hostilities;Not available,Not available,0,Not available,Not available,Not available,Not available,Not available,Not available;Not available,Not available;Not available,Countermeasures under international law justified (state-atttribution & breach of international law),Not available,https://thehackernews.com/2024/12/secret-blizzard-deploys-kazuar-backdoor.html;https://www.microsoft.com/en-us/security/blog/2024/12/11/frequent-freeloader-part-ii-russian-actor-secret-blizzard-using-tools-of-other-groups-to-attack-ukraine/,2024-12-12,2025-03-03
4128,Cybercriminal group Storm-1919 and Russian state-sponsored actor Secret Blizzard (also known as Turla) deployed Tavdig and Kazuar backdoor on Ukrainian military devices beginning in March 2024,"Between March and April 2024, the Russian state-sponsored actor Secret Blizzard, also known as Turla, was observed leveraging the Amadey bot malware to deploy a known backdoor called Kazuar on target devices associated with the Ukrainian military. The attack involved commandeering Amadey bots to deploy a backdoor known as Tavdig, which was then used to install an updated version of Kazuar. The Microsoft threat intelligence team reported the cyber attack on 11 December 2024.
Microsoft was still investigating whether Secret Blizzard leveraged access to Storm-1837's backdoor or purchased access, indicating cooperation in the form of Malware-as-a-Service (MaaS).
Microsoft assumed that Secret Blizzard likely wanted to exploit this access to gain further strategic access at the ministerial level. The background to this cyber incident was an incident published a week earlier in the first part of the report, which is also available here. In that incident, Secret Blizzard compromised the infrastructure of Pakistani threat actor Storm-0156 to gain access to Afghan government entities' computer systems.",01.03.2024,Not available,"Attack conducted by non-state group / non-state actor with political goals (religious, ethnic, etc. groups) / undefined actor with political goals;Attack on (inter alia) political target(s), not politicized","Attack conducted by a state-affiliated group (includes state-sanctioned, state-supported, state-controlled but officially non-state actors) (“cyber-proxies”) / a group that is generally attributed as state-affiliated ;Not available",Incident disclosed by IT-security company,Hijacking without Misuse,Not available,Ukraine,UA,"['EUROPE', 'EASTEU']",State institutions / political system,Military,"Turla/Waterbug/Venomous Bear/Snake/Uroburos/Group 88/Secret Blizzard fka KRYPTON/G0010/UAC-0003 (FSB Centre 16, Unit 71330);Storm-1919",Russia;Russia,RU;RU,State affiliated actor;Non-state-group,"Non-state-group, state-affiliation suggested (widely held view for the attributed initiator (group), but not invoked in this case);Criminal(s)",1,24814;24814,11.12.2024;11.12.2024,"Technical report (e.g., by IT-companies, Citizen Lab, EFF);Technical report (e.g., by IT-companies, Citizen Lab, EFF)",IT-security community attributes attacker;IT-security community attributes attacker,Microsoft;Microsoft,Microsoft Security Intelligence;Microsoft Security Intelligence,United States;United States,True;True,Russia;Russia,State affiliated actor;Non-state-group,https://www.microsoft.com/en-us/security/blog/2024/12/11/frequent-freeloader-part-ii-russian-actor-secret-blizzard-using-tools-of-other-groups-to-attack-ukraine/,International power,International power,Russia – Ukraine,Yes / HIIK intensity,HIIK 5,0,Not available,Not available,Not available,Not available,Not available,Not available,Not available,Not available,Not available,Not available,False,Not available,Not available,"Hijacking, not used - empowerment (incident scores 1 point in intensity)",none,none,1,"Very high political importance (e.g., critical infrastructure, military) - intensity multiplied by 1.5",2,Low,6,No system interference/disruption,"Minor data breach/exfiltration (no critical/sensitive information), but no data corruption (deletion/altering) or leaking of data  ",1-10,0,1-10,1,None,0,euro,Indirect (knowingly sanctioning / ordering / ideological / material support by official members of state entities/agencies/units for officially non-state-actors),Cyber espionage;Human rights;Armed conflict;Sovereignty,Non-state actors;Civic / political rights;Conduct of hostilities;Not available,Not available,0,Not available,Not available,Not available,Not available,Not available,Not available;Not available,Not available;Not available,Countermeasures under international law justified (state-atttribution & breach of international law),Not available,https://thehackernews.com/2024/12/secret-blizzard-deploys-kazuar-backdoor.html;https://www.bleepingcomputer.com/news/security/russian-cyber-spies-hide-behind-other-hackers-to-target-ukraine/;https://cyberscoop.com/turla-leverage-cybercriminal-tools-target-ukraine-microsoft/;https://www.microsoft.com/en-us/security/blog/2024/12/11/frequent-freeloader-part-ii-russian-actor-secret-blizzard-using-tools-of-other-groups-to-attack-ukraine/,2024-12-12,2025-01-08
