4107,The Pakistani-based threat actor Storm-0156 (also known as SideCopy or Transparent Tribe) compromised Afghan government networks beginning December 2022 at the latest,"The Pakistani-based threat actor Storm-0156 (also known as SideCopy or Transparent Tribe) compromised Afghan government networks between December 2022 and mid-2023, using CrimsonRAT and Waiscot malware to gain access to these systems. This campaign focused on espionage, collecting sensitive information from Afghan government entities. Storm-0156's activities align with its broader objective of targeting South Asia's government, military, and industrial systems for intelligence.
Additionally, in another cyber incident, the Russian state-sponsored hacking group Turla infiltrated the Pakistani threat actor and used that access to infiltrate the Afghan government.",01.12.2022,Not available,"Attack conducted by non-state group / non-state actor with political goals (religious, ethnic, etc. groups) / undefined actor with political goals;Attack on (inter alia) political target(s), not politicized","Attack conducted by a state-affiliated group (includes state-sanctioned, state-supported, state-controlled but officially non-state actors) (“cyber-proxies”) / a group that is generally attributed as state-affiliated ;Not available",Incident disclosed by IT-security company,Data theft;Hijacking with Misuse,Not available,Afghanistan,AF,"['ASIA', 'SASIA']",State institutions / political system,Government / ministries,APT-36/Transparent Tribe/Mythic Leopard/C-Major,Pakistan,PK,State affiliated actor,"Non-state-group, state-affiliation suggested (widely held view for the attributed initiator (group), but not invoked in this case)",1,24799,04.12.2024,"Technical report (e.g., by IT-companies, Citizen Lab, EFF)",IT-security community attributes attacker,Black Lotus Labs,Black Lotus Labs,United States,True,Pakistan,State affiliated actor,https://blog.lumen.com/snowblind-the-invisible-hand-of-secret-blizzard/,Unknown,Unknown,Not available,Unknown,Not available,0,Not available;Not available,Not available;Not available,Not available;Not available,Afghanistan;Pakistan,Not available;Not available,Not available,Not available,Not available,Data Exfiltration,Not available,False,For private / commercial targets: sensitive information (incident scores 2 points in intensity),Not available,"Hijacking, system misuse, e.g., through data theft and / or disruption (incident scores 2 points in intensity)",none,none,4,"Very high political importance (e.g., critical infrastructure, military) - intensity multiplied by 1.5",6,Minor,5,No system interference/disruption,No data breach/exfiltration or data corruption (deletion/altering) and/or leaking of data,1-10,0,1-10,1,None,0,euro,Indirect (knowingly sanctioning / ordering / ideological / material support by official members of state entities/agencies/units for officially non-state-actors),Cyber espionage;Sovereignty,Non-state actors;Not available,Not available,0,Not available,Not available,Not available,Not available,Not available,Not available,Not available,Countermeasures under international law justified (state-atttribution & breach of international law),Not available,https://blog.lumen.com/snowblind-the-invisible-hand-of-secret-blizzard/;https://www.zataz.com/fuite-de-donnees-chez-auchan-les-cagnottes-de-fidelite-un-juteux-business-pirate/,2024-12-06,2025-01-08
4106,Russian state-sponsored hacking group Turla (also known as Secret Blizzard) breached the infrastructure of Pakistani threat actor Storm-0156 and hijacked their command and control servers to gain access into already compromised networks of the Afghan government beginning in December 2022,"Between December 2022 and October 2024, the Russian state-sponsored hacking group Secret Blizzard (also known as Turla) breached the infrastructure of Pakistani threat actor Storm-0156. It hijacked their command and control servers to gain access to already compromised networks of the Afghan government. Turla deployed their malware tools, TwoDash and Statuezy. The attackers also targeted the Pakistani threat actors, gaining access to valuable data such as malware tools and stolen credentials and data. Lumen's Black Lotus Labs and Microsoft's Threat Intelligence Team tracked this campaign and reported that Turla's operation was primarily used to deploy backdoors on Afghan government entities. The attackers' approach allowed them to gather intelligence stealthily without exposing themselves or their toolset, shifting blame and complicating attribution efforts.",01.12.2022,10.10.2024,"Attack conducted by non-state group / non-state actor with political goals (religious, ethnic, etc. groups) / undefined actor with political goals;Attack on (inter alia) political target(s), not politicized","Attack conducted by a state-affiliated group (includes state-sanctioned, state-supported, state-controlled but officially non-state actors) (“cyber-proxies”) / a group that is generally attributed as state-affiliated ;Not available",Incident disclosed by IT-security company,Data theft & Doxing;Disruption;Hijacking with Misuse,Not available;Storm-0156,Afghanistan;Pakistan,AF;PK,"['ASIA', 'SASIA'];['ASIA', 'SASIA', 'SCO']",State institutions / political system;Social groups,Government / ministries;Other social groups,"Turla/Waterbug/Venomous Bear/Snake/Uroburos/Group 88/Secret Blizzard fka KRYPTON/G0010/UAC-0003 (FSB Centre 16, Unit 71330)",Russia,RU,State affiliated actor,Not available,1,24798,04.12.2024,"Technical report (e.g., by IT-companies, Citizen Lab, EFF)",IT-security community attributes attacker,Black Lotus Labs,Black Lotus Labs,United States,True,Russia,State affiliated actor,https://blog.lumen.com/snowblind-the-invisible-hand-of-secret-blizzard/,Unknown,Unknown,Not available,Unknown,Not available,0,Not available;Not available,Not available;Not available,Not available;Not available,Pakistan;Afghanistan,Not available;Not available,Not available,Not available,Not available,Data Exfiltration,Not available,True,For private / commercial targets: sensitive information (incident scores 2 points in intensity),Not available,"Hijacking, system misuse, e.g., through data theft and / or disruption (incident scores 2 points in intensity)",none,none,4,"Very high political importance (e.g., critical infrastructure, military) - intensity multiplied by 1.5",6,Medium,12,Weeks (< 4 weeks),Major data breach/exfiltration (critical/sensitive information) & data corruption (deletion/altering) and/or leaking of data ,1-10,0,1-10,2,None,0,euro,Indirect (knowingly sanctioning / ordering / ideological / material support by official members of state entities/agencies/units for officially non-state-actors),Cyber espionage;Human rights;Sovereignty,Non-state actors;Civic / political rights;Not available,Not available,0,Not available,Not available,Not available,Not available,Not available,Not available,Not available,Countermeasures under international law justified (state-atttribution & breach of international law),Not available,https://www.bleepingcomputer.com/news/security/russian-turla-hackers-hijack-pakistani-apt-servers-for-cyber-espionage-attacks/;https://thehackernews.com/2024/12/russia-linked-turla-exploits-pakistani.html;https://cyberscoop.com/turla-infiltrates-pakistani-apt-networks-microsoft-lumen/;https://securityaffairs.com/171699/apt/secret-blizzard-using-infrastructure-of-other-threat-actors.html;https://blog.lumen.com/snowblind-the-invisible-hand-of-secret-blizzard/,2024-12-06,2025-01-08
4105,China-linked threat actor MirrorFace delivered ANEL and NOOPDOOR backdoors to individuals and organizations in Japan via spear-phishing campaign in June 2024,"In June 2024, the China-linked threat actor known as MirrorFace launched a spear-phishing campaign targeting individuals and organizations in Japan, delivering backdoors known as NOOPDOOR and ANEL. The campaign used emails with links to Microsoft OneDrive, containing booby-trapped ZIP archives with themes related to interview requests and Japan’s economic security. The attackers used three infection vectors, including macro-enabled Word documents and Windows shortcut files, to deliver a malicious dropper called ROAMINGMOUSE, which acted as a dropper for ANEL and NOOPDOOR components. The backdoors were used to capture screenshots, upload/download files, load executables, and run commands via cmd.exe. Trend Micro reported the attack and provided technical analysis. The campaign was ongoing as of December 2024.",01.06.2024,Not available,"Attack conducted by non-state group / non-state actor with political goals (religious, ethnic, etc. groups) / undefined actor with political goals;Attack on critical infrastructure target(s)","Attack conducted by a state-affiliated group (includes state-sanctioned, state-supported, state-controlled but officially non-state actors) (“cyber-proxies”) / a group that is generally attributed as state-affiliated ;Not available",Incident disclosed by IT-security company,Data theft;Disruption;Hijacking with Misuse,Not available;Not available,Japan;Japan,JP;JP,"['ASIA', 'SCS', 'NEA'];['ASIA', 'SCS', 'NEA']",Critical infrastructure;Social groups,Research;Advocacy / activists (e.g. human rights organizations),"Earth Kasha < APT10/Stone Panda/MenuPass Team/Cloud Hopper/Red Apollo/Cicada/POTASSIUM/BRONZE RIVERSIDE/CVNX/HOGFISH/G0045 (MSS, Tianjin State Security Bureau)",China,CN,State affiliated actor,"Non-state-group, state-affiliation suggested (widely held view for the attributed initiator (group), but not invoked in this case)",1,24797,26.11.2024,"Technical report (e.g., by IT-companies, Citizen Lab, EFF)",IT-security community attributes attacker,Trend Micro,Trend Micro,Japan,True,China,State affiliated actor,https://www.trendmicro.com/en_us/research/24/k/return-of-anel-in-the-recent-earth-kasha-spearphishing-campaign.html,Unknown,Territory,China - Japan (East China Sea),Yes / HIIK intensity,HIIK 2,0,Not available,Not available,Not available,Japan,Not available,Not available,Not available,Not available,Data Exfiltration,Not available,True,For private / commercial targets: non-sensitive information (incident scores 1 point in intensity),Not available,"Hijacking, system misuse, e.g., through data theft and / or disruption (incident scores 2 points in intensity)",none,none,3,Moderate - high political importance,3,Low,9,Days (< 7 days),"Minor data breach/exfiltration (no critical/sensitive information), but no data corruption (deletion/altering) or leaking of data  ",11-50,0,1-10,1,None,0,euro,Indirect (knowingly sanctioning / ordering / ideological / material support by official members of state entities/agencies/units for officially non-state-actors),Cyber espionage;Human rights;Sovereignty,Non-state actors;Civic / political rights;Not available,Not available,0,Not available,Not available,Not available,Not available,Not available,Not available,Not available,Countermeasures under international law justified (state-atttribution & breach of international law),Not available,https://thehackernews.com/2024/12/anel-and-noopdoor-backdoors-weaponized.html;https://www.trendmicro.com/en_us/research/24/k/return-of-anel-in-the-recent-earth-kasha-spearphishing-campaign.html;https://www.bleepingcomputer.com/news/security/mirrorface-hackers-targeting-japanese-govt-politicians-since-2019/;https://www.csoonline.com/article/3691710/china-linked-hackers-target-japans-national-security-and-high-tech-industries.html;https://securityaffairs.com/172890/apt/china-linked-apt-mirrorface-targets-japan.html;https://www.infosecurity-magazine.com/news/japan-faces-cyberattacks-china/,2024-12-06,2025-01-13
4103,"Cybercriminal group FOG launched a ransomware attack on Rossi Group, medical company in Argentina, around 23 November 2024","Around 23 November 2024, the Rossi Group, which includes Rossi, Stamboulian and Hidalgo Laboratory medical centers, suffered a ransomware cyberattack by the FOG group, which paralyzed the systems, lowered websites, and prevented patients from doing studies and taking turns. The attackers encrypted information and asked for a cryptocurrency ransom in return, but no deadline was given, and the company did not enter into negotiations. According to the company's CEO, Omar De Fornari, no patient data was compromised, but forensic analysis has not confirmed this.",23.11.2024,23.11.2024,Attack on critical infrastructure target(s),Not available,Incident disclosed by media (without further information on source);Incident disclosed by victim,Hijacking with Misuse;Ransomware,Hidalgo Laboratory;Stamboulian Health Services;Rossi Center,Argentina;Argentina;Argentina,AR;AR;AR,['SOUTHAM'];['SOUTHAM'];['SOUTHAM'],Critical infrastructure;Critical infrastructure;Critical infrastructure,Health;Health;Health,FOG,Argentina,AR,Non-state-group,Criminal(s),1,24796,03.12.2024,"Direct statement in media report (e.g., Reuters article cites the attribution statements by a person) / self-attribution via social media",Not available,Not available,Not available,Not available,True,Argentina,Non-state-group,https://www.clarin.com/tecnologia/hackean-centros-estudios-medicos-rossi-stamboulian-hidalgo-sabe-ataque-volverian-normalidad_0_FqplYX3Y7d.html,Not available,Not available,Not available,Not available,Not available,0,Not available,Not available,Not available,Argentina,Not available,Not available,Not available,Not available,Data Encrypted for Impact,Not available,False,Not available,Not available,"Hijacking, system misuse, e.g., through data theft and / or disruption (incident scores 2 points in intensity)",none,none,2,Moderate - high political importance,2,Minor,5,No system interference/disruption,No data breach/exfiltration or data corruption (deletion/altering) and/or leaking of data,1-10,3,1-10,1,None,0,euro,None/Negligent,Not available,Not available,Not available,1,2024-12-3,"Other legal measures on national level (e.g. law enforcement investigations, arrests)",Not available,Argentina,Argentine Federal Police,Not available,Not available,No response justified (missing state attribution & breach of international law),Not available,https://www.clarin.com/tecnologia/hackean-centros-estudios-medicos-rossi-stamboulian-hidalgo-sabe-ataque-volverian-normalidad_0_FqplYX3Y7d.html,2024-12-05,2025-01-08
4101,"Unknown threat actors launched a ransomware attack on ENGlobal Corporation, encrypting some of its data files on 25 November 2024","On 25 November 2024, Unknown Threat Actors launched a ransomware attack against ENGlobal Corporation, a major energy industry contractor, by illegally accessing and encrypting some of its data files, limiting employee access to its IT system and hindering operations. ENGlobal Corporation reported the incident to the U.S. Securities and Exchange Commission, has started an internal investigation, and has hired external cybersecurity experts to address the issue.
On January 27, 2025, ENGlobal Corporation updated its first report and added that the incident disrupted access to key business applications, including financial and operational reporting systems, for approximately six weeks. However, as of January 27, 2025, all operations and corporate functions have been fully restored, and the Company believes the threat actor no longer has access to its systems. Additionally, the affected IT system contained sensitive personal information, and the Company plans to notify impacted individuals and relevant regulatory authorities in compliance with federal and state laws.",25.11.2024,27.01.2024,Attack on critical infrastructure target(s),Not available,Incident disclosed by victim,Data theft;Disruption;Hijacking with Misuse;Ransomware,ENGlobal Corporation,United States,US,"['NATO', 'NORTHAM']",Critical infrastructure,Critical Manufacturing,Not attributed,Not attributed,Not attributed,Not attributed,Not available,1,25049,Not available,Not available,Not available,Not available,Not available,Not available,True,Not attributed,Not attributed,Not available,Unknown,Unknown,Not available,Unknown,Not available,0,Not available,Not available,Not available,United States,US Securities and Exchange Commission (USA),Not available,Not available,Not available,Account Access Removal,Not available,True,Not available,Long-term disruption (> 24h; incident scores 2 points in intensity),"Hijacking, system misuse, e.g., through data theft and / or disruption (incident scores 2 points in intensity)",none,none,4,Moderate - high political importance,4,Low,6,Days (< 7 days),No data breach/exfiltration or data corruption (deletion/altering) and/or leaking of data,1-10,1,1-10,1,Not available,0,euro,Not available,Sovereignty,Not available,Not available,0,Not available,Not available,Not available,Not available,Not available,Not available,Not available,Unfriendly acts/retorsions justified (missing state-attribution & breach ofinternational law OR state-attribution & missing breach of international law),Not available,https://www.bloomberght.com/abd-hukumetinin-cozum-ortagi-englobal-siber-saldiriya-ugradi-3736116;https://therecord.media/energy-industry-contractor-ransomware-disruption;https://www.sec.gov/Archives/edgar/data/933738/000165495424015098/eng_8k.htm;https://securityaffairs.com/171617/cyber-crime/englobal-corporation-disclosed-a-ransomware-attack.html;https://www.infosecurity-magazine.com/news/ransomware-disrupts-us-contractor/;https://research.checkpoint.com/2024/9th-december-threat-intelligence-report/;https://app.quotemedia.com/data/downloadFiling?webmasterId=90423&ref=318866297&type=HTML&symbol=ENGC&cdn=d3dab061796acf177f043b64768817e2&companyName=ENGlobal+Corporation&formType=8-K%2FA&formDescription=%5BAmend%5DCurrent+report+pursuant+to+Section+13+or+15%28d%29&dateFiled=2025-01-27,2024-12-04,2025-01-30
4100,Unknown threat actors encrypted the electronic systems of three medical practices and their branches at the Hofer Medical Center in Germany on 25 November 2024,"Unknown threat actors encrypted the electronic systems of three medical practices and their branches at the Hofer Medical Center in Germany on 25 November 2024, reported the Frankenpost on 26 November 2024. Since then, the electronic systems have been non-functional. Countermeasures and the consequences for patients are currently being assessed.",25.11.2024,25.11.2024,Attack on critical infrastructure target(s),Not available,Incident disclosed by media (without further information on source),Disruption;Hijacking with Misuse,Hofer Ärztezentrum,Germany,DE,"['EUROPE', 'NATO', 'EU', 'WESTEU']",Critical infrastructure,Health,Not attributed,Not attributed,Not attributed,Not attributed,Not available,1,24794,Not available,Not available,Not available,Not available,Not available,Not available,True,Not attributed,Not attributed,Not available,Not available,Not available,Not available,Not available,Not available,0,Not available,Not available,Not available,Germany,Not available,Not available,Not available,Not available,Not available,Not available,True,Not available,Not available,"Hijacking, system misuse, e.g., through data theft and / or disruption (incident scores 2 points in intensity)",none,none,2,Moderate - high political importance,2,Low,7,Days (< 7 days),No data breach/exfiltration or data corruption (deletion/altering) and/or leaking of data,1-10,1,Not available,0,None,0,euro,Not available,Human rights;Sovereignty,"Economic, social and cultural rights;Not available",Not available,0,Not available,Not available,Not available,Not available,Not available,Not available,Not available,Unfriendly acts/retorsions justified (missing state-attribution & breach ofinternational law OR state-attribution & missing breach of international law),Not available,https://www.computerweekly.com/de/news/366616425/Die-Cyberangriffe-der-KW48-2024-im-Ueberblick,2024-12-04,2025-01-08
4099,Suspected Russian hackers stole e-mail adresses and login credentials of nearly 600 employees of the UK Ministry of Defence in November 2024,"A significant cyberattack has targeted the UK Ministry of Defence (MoD), resulting in the theft and leak of nearly 600 employee passwords on the dark web. inews first reported on this cyber incident on 29 November 2024.
The breach, attributed to suspected Russian hackers, exposed sensitive information of military personnel, civilian staff, and defence contractors. The stolen credentials provided access to the Defence Gateway portal, a critical platform for communication, HR services, and health records, though it does not store classified information.
Affected employees are primarily UK-based, with others stationed overseas in Iraq, Qatar, Cyprus, and mainland Europe.
Initial investigations suggest hackers exploited vulnerabilities in personal devices used to access the platform, bypassing its multi-factor authentication system. Although no direct evidence links the attack to the Kremlin, the tools used indicate state-sponsored involvement, aligning with previous high-profile cyberattacks on Western institutions.
The MoD, in collaboration with the National Cyber Security Centre (NCSC), is investigating and working to mitigate potential harm. This incident occurs amidst heightened UK-Russia tensions, underscoring growing concerns over cyberattacks and espionage activities targeting critical national infrastructure.",01.01.2024,Not available,"Attack on (inter alia) political target(s), not politicized",Not available,Incident disclosed by media (without further information on source),Data theft & Doxing;Hijacking with Misuse,Ministry of Defence (United Kingdom),United Kingdom,GB,"['EUROPE', 'NATO', 'NORTHEU']",State institutions / political system,Government / ministries,Unknown,Russia,RU,Unknown,Not available,1,24555,02.12.2024,"Media report (e.g., Reuters makes an attribution statement, without naming further sources)",Not available,Not available,Not available,Not available,True,Russia,Unknown,https://www.computing.co.uk/news/2024/security/mod-hit-by-major-cyberattack,International power,Territory;International power,"Russia – Ukraine;EU, USA et. al –  Russia",Yes / HIIK intensity;Yes / HIIK intensity,HIIK 5;HIIK 5,1,29.11.2024,State Actors: Stabilizing measures,Statement by other ministers (or spokespersons)/members of parliament,United Kingdom,United Kingdom`s National Cyber Security Centre (NCSC),Not available,Not available,Not available,Data Exfiltration,Not available,False,For private / commercial targets: sensitive information (incident scores 2 points in intensity),Not available,"Hijacking, system misuse, e.g., through data theft and / or disruption (incident scores 2 points in intensity)",none,none,4,"Very high political importance (e.g., critical infrastructure, military) - intensity multiplied by 1.5",6,Low,9,No system interference/disruption,Major data breach/exfiltration (critical/sensitive information) & data corruption (deletion/altering) and/or leaking of data ,1-10,1,1-10,1,None,0,euro,None/Negligent,Cyber espionage;Human rights;Due diligence;Sovereignty,Not available;Civic / political rights;Not available;Not available,Not available,1,2024-12-2,"Other legal measures on national level (e.g. law enforcement investigations, arrests)",Not available,United Kingdom,UK Ministry of Defence,Not available,Not available,Countermeasures under international law justified (state-atttribution & breach of international law),Not available,https://www.computing.co.uk/news/2024/security/mod-hit-by-major-cyberattack;https://www.dailymail.co.uk/news/article-14140911/russian-hackers-stole-ministry-defence-passwords-posted-dark-web.html;https://swarmnetics.com/blog/600-stolen-passwords-from-uk-ministry-of-defence-appear-on-dark-web-attributed-to-russian-hackers/;https://www.mirror.co.uk/news/uk-news/breaking-russian-hacking-software-used-34216286,2024-12-03,2025-02-18
