incident_id,name,description,start_date,end_date,inclusion_criterion,inclusion_criterion_subcode,source_disclosure,incident_type,receiver_name,receiver_country,receiver_country_alpha_2_code,receiver_regions,receiver_category,receiver_subcategory,initiator_name,initiator_country,initiator_alpha_2,initiator_category,initiator_subcategory,number_attributions,attribution_id,attribution_date,attribution_type,attribution_basis,attributing_actor,attributing_company,attributing_country,settled_initiator,initiator_country,initiator_category,attribution_source_url,cyber_conflict_issue,offline_conflict_issue,offline_conflict_name,offline_conflict_intensity,offline_conflict_intensity_subcode,number_political_responses,political_response_date,political_response_type,political_response_subtype,political_response_responding_country,political_response_responding_actor,zero_days,zero_days_subcode,mitre_initial_access,mitre_impact,user_interaction,has_disruption,data_theft,disruption,hijacking,physical_effects_spatial,physical_effects_temporal,unweighted_intensity,target_multiplier,weighted_intensity,impact_indicator_label,impact_indicator_score,functional_impact,intelligence_impact,affected_entities,affected_entities_value,affected_third_countries,affected_third_countries_value,economic_impact,economic_impact_value,economic_impact_currency,state_responsibility_actor,il_breach_indicator,il_breach_indicator_subcode,evidence_for_sanctions_indicator,number_legal_responses,legal_response_date,legal_response_type,legal_response_subtype,legal_response_responding_country,legal_response_responding_actor,attribution_legal_reference,attribution_legal_reference_subcode,response_indicator,casualties,source_url,added_to_db,updated_at
4163, Russian State-Sponsored Actors Linked to GRU Disrupted Ukrainian State Registries in Cyber-Attack on 19 December 2024,"On 19 December 2024, a cyber attack attributed to Russian state-sponsored actors linked to the GRU temporarily disrupted Ukraine's state registries, managed by the Ministry of Justice. The attack, described as the largest of its kind on the country's registries, suspended online services for administrative matters like marriages, car registrations, and changes of residence.
Deputy Prime Minister and Justice Minister Olha Stefanishyna stated the attack aimed to ""instill panic among Ukrainian citizens and those abroad"" and noted it had been prepared for several months. While no data leaks or thefts have been confirmed, all registries remain offline as a precautionary measure. Restoration efforts are underway, with basic services expected to resume within two weeks. Ukrainian authorities, including the SSU, are conducting a criminal investigation, with suspicions centered on a GRU-affiliated hacker group.",19.12.2024,19.12.2024,"Attack conducted by nation state (generic “state-attribution” or direct attribution towards specific state-entities, e.g., intelligence agencies);Attack on (inter alia) political target(s), politicized",Not available;Not available,Incident disclosed by authorities of victim state,Disruption;Hijacking with Misuse,Ministry of Justice (Ukraine),Ukraine,UA,"['EUROPE', 'EASTEU']",State institutions / political system,Government / ministries,Unknown,Russia,RU,State,Not available,1,25486,19.12.2024,"Direct statement in media report (e.g., Reuters article cites the attribution statements by a person) / self-attribution via social media",Attribution by receiver government / state entity,Deputy Prime Minister and Justice Minister Olga Stefanishyna,Not available,Ukraine,True,Russia,State,https://www.facebook.com/olga.kravets.796/posts/pfbid0JLefxB1dChT958UwVzAKjDPYZHGXysGHpH3rfYjxcxdYz27Azr3EW5JRDaoMqrAUl,International power,Territory;International power,Russia – Ukraine;Russia – Ukraine,Yes / HIIK intensity;Yes / HIIK intensity,HIIK 5;HIIK 5,1,19.12.2024,State Actors: Stabilizing measures,Statement by head of state/head of government (or executive official),Ukraine,Deputy Prime Minister (Olha Stefanishyna) (Ukraine),Not available,Not available,Not available,Data Destruction,Not available,True,Not available,Long-term disruption (> 24h; incident scores 2 points in intensity),"Hijacking, system misuse, e.g., through data theft and / or disruption (incident scores 2 points in intensity)",none,none,4,Moderate - high political importance,4,Low,8,Weeks (< 4 weeks),No data breach/exfiltration or data corruption (deletion/altering) and/or leaking of data,1-10,0,1-10,1,None,0,euro,Direct (official members of state entities / agencies / units responsible),Armed conflict;Sovereignty,Conduct of hostilities;Not available,Not available,1,2024-12-19,"Other legal measures on national level (e.g. law enforcement investigations, arrests)",Not available,Ukraine,Security Service of Ukraine (SBU),Not available,Not available,Countermeasures under international law justified (state-atttribution & breach of international law),Not available,https://www.t-online.de/nachrichten/ukraine/id_100553226/ukraine-krieg-russland-greift-kiew-mit-hyperschallraketen-an-.html;https://www.facebook.com/olga.kravets.796/posts/pfbid0JLefxB1dChT958UwVzAKjDPYZHGXysGHpH3rfYjxcxdYz27Azr3EW5JRDaoMqrAUl;https://www.yahoo.com/news/number-cyberattacks-ukraine-increased-70-070339720.html;https://www.infosecurity-magazine.com/news/ukraine-state-registers-restored/;https://www.cyberdaily.au/security/11610-ukraine-s-state-register-restored-after-russian-cyber-attack;https://www.biometricupdate.com/202501/russian-hack-of-ukrainian-databases-shows-flaws-in-system-experts-say,2024-12-23,2025-02-18
4161,"Unknown threat actors stole Microsoft Azure account credentials from automotive, chemical, and industrial manufacturing companies in Europe beginning in June 2024","Unit 42 researchers uncovered a phishing campaign targeting European companies, particularly in Germany and the UK, within automotive, chemical, and industrial compound manufacturing industries from June 2024 to at least September 2024. Palo Alto Networks reported the campaign and its findings on December 18, 2024.
The campaign aimed to harvest account credentials to take over victims' Microsoft Azure cloud infrastructure. Attackers used phishing emails containing malicious PDFs or HTML links created via the HubSpot Free Form Builder service. Victims clicking these links were redirected to credential-harvesting pages disguised as legitimate Microsoft login portals.
This campaign targeted approximately 20,000 users. Once credentials were harvested, attackers exploited them to access Microsoft Azure accounts, conduct lateral movements, and establish persistent control, even during active attempts to block their access. The attackers also used VPN proxies to mask their origins and mimic logins from trusted locations.",01.06.2024,Not available,Attack on critical infrastructure target(s),Not available,Incident disclosed by IT-security company,Data theft;Hijacking with Misuse,Not available;Not available;Not available;Not available;Not available;Not available;Not available;Not available;Not available,Germany;Germany;Germany;United Kingdom;United Kingdom;United Kingdom;Europe (region);Europe (region);Europe (region),DE;DE;DE;GB;GB;GB;EUROPE;EUROPE;EUROPE,"['EUROPE', 'NATO', 'EU', 'WESTEU'];['EUROPE', 'NATO', 'EU', 'WESTEU'];['EUROPE', 'NATO', 'EU', 'WESTEU'];['EUROPE', 'NATO', 'NORTHEU'];['EUROPE', 'NATO', 'NORTHEU'];['EUROPE', 'NATO', 'NORTHEU'];['Not available'];['Not available'];['Not available']",Critical infrastructure;Corporate Targets (corporate targets only coded if the respective company is not part of the critical infrastructure definition);Critical infrastructure;Critical infrastructure;Corporate Targets (corporate targets only coded if the respective company is not part of the critical infrastructure definition);Critical infrastructure;Critical infrastructure;Corporate Targets (corporate targets only coded if the respective company is not part of the critical infrastructure definition);Critical infrastructure,Chemicals;Not available;Critical Manufacturing;Chemicals;Not available;Critical Manufacturing;Chemicals;Not available;Critical Manufacturing,Not attributed,Not attributed,Not attributed,Not attributed,Not available,1,25488,Not available,Not available,Not available,Not available,Not available,Not available,True,Not attributed,Not attributed,Not available,Unknown,Unknown,Not available,Unknown,Not available,0,Not available,Not available,Not available,Not available,Not available,No,Not available,Phishing,Account Access Removal,Not available,False,For private / commercial targets: non-sensitive information (incident scores 1 point in intensity),Not available,"Hijacking, system misuse, e.g., through data theft and / or disruption (incident scores 2 points in intensity)",none,none,3,Moderate - high political importance,3,Low,6,No system interference/disruption,"Minor data breach/exfiltration (no critical/sensitive information), but no data corruption (deletion/altering) or leaking of data  ",1-10,0,Not available,0,None,0,euro,Not available,Human rights;Sovereignty,Civic / political rights;Not available,Not available,0,Not available,Not available,Not available,Not available,Not available,Not available,Not available,Unfriendly acts/retorsions justified (missing state-attribution & breach ofinternational law OR state-attribution & missing breach of international law),Not available,https://www.bleepingcomputer.com/news/security/hubspot-phishing-targets-20-000-microsoft-azure-accounts/;https://unit42.paloaltonetworks.com/european-phishing-campaign/,2024-12-20,2025-02-18
4160,Unspecified US intelligence agencies stole trade secrets from a a major Chinese high-tech enterprise since at least May 2023,"The Chinese National Internet Emergency Response Center (CNCERT) reported two cyberattacks on December 18, 2024, in which the United States stole trade secrets.
In the second incident, suspected U.S. intelligence agencies have targeted a major high-tech enterprise in China's smart energy and digital information sector since May 2023. The attackers exploited vulnerabilities in Microsoft Exchange to hack into and control the company's mail servers, implanting backdoors to steal email data continuously. They also used the compromised mail servers as a springboard to attack and control over 30 devices belonging to the company and its subsidiaries. As a result, the attackers stole a significant amount of the company’s trade secret information. The incident involved using multiple overseas platforms to mask the attack's origin.",01.05.2023,Not available,"Attack conducted by nation state (generic “state-attribution” or direct attribution towards specific state-entities, e.g., intelligence agencies)",Not available,Incident disclosed by authorities of victim state,Data theft;Hijacking with Misuse,Not available,China,CN,"['ASIA', 'SCS', 'EASIA', 'NEA', 'SCO']",Corporate Targets (corporate targets only coded if the respective company is not part of the critical infrastructure definition),Not available,Unknown,United States,US,State,Not available,1,25487,18.12.2024,"Political statement / report (e.g., on government / state agency websites)",Attribution by receiver government / state entity,CNCERT,Not available,China,True,United States,State,"https://www.cert.org.cn/publish/main/49/2024/20241218184234131217571/20241218184234131217571_.html#:~:text=%E5%9B%BD%E5%AE%B6%E4%BA%92%E8%81%94%E7%BD%91%E5%BA%94%E6%80%A5%E4%B8%AD%E5%BF%83%E5%8F%91%E7%8E%B0%E5%A4%84%E7%BD%AE%E4%B8%A4%E8%B5%B7%E7%BE%8E%E5%AF%B9%E6%88%91%E5%A4%A7%E5%9E%8B%E7%A7%91%E6%8A%80%E4%BC%81%E4%B8%9A%E6%9C%BA%E6%9E%84%E8%BF%9B%E8%A1%8C%E7%BD%91%E7%BB%9C%E6%94%BB%E5%87%BB%E7%AA%83%E5%8F%96%E5%95%86%E4%B8%9A%E7%A7%98%E5%AF%86%E4%BA%8B%E4%BB%B6%E3%80%82%202024%E5%B9%B48%E6%9C%88%E8%B5%B7%EF%BC%8C%E6%88%91%E5%9B%BD%E6%9F%90%E5%85%88%E8%BF%9B%E6%9D%90%E6%96%99%E8%AE%BE%E8%AE%A1%E7%A0%94%E7%A9%B6%E5%8D%95%E4%BD%8D%E9%81%AD%E7%96%91%E4%BC%BC%E7%BE%8E%E5%9B%BD%E6%83%85%E6%8A%A5%E6%9C%BA%E6%9E%84%E7%BD%91%E7%BB%9C%E6%94%BB%E5%87%BB%E3%80%82,%E7%BB%8F%E5%88%86%E6%9E%90%EF%BC%8C%E6%94%BB%E5%87%BB%E8%80%85%E5%88%A9%E7%94%A8%E6%88%91%E5%A2%83%E5%86%85%E6%9F%90%E7%94%B5%E5%AD%90%E6%96%87%E6%A1%A3%E5%AE%89%E5%85%A8%E7%AE%A1%E7%90%86%E7%B3%BB%E7%BB%9F%E6%BC%8F%E6%B4%9E%EF%BC%8C%E5%85%A5%E4%BE%B5%E8%AF%A5%E5%85%AC%E5%8F%B8%E9%83%A8%E7%BD%B2%E7%9A%84%E8%BD%AF%E4%BB%B6%E5%8D%87%E7%BA%A7%E7%AE%A1%E7%90%86%E6%9C%8D%E5%8A%A1%E5%99%A8%EF%BC%8C%E9%80%9A%E8%BF%87%E8%BD%AF%E4%BB%B6%E5%8D%87%E7%BA%A7%E6%9C%8D%E5%8A%A1%E5%90%91%E8%AF%A5%E5%85%AC%E5%8F%B8%E7%9A%84270%E4%BD%99%E5%8F%B0%E4%B8%BB%E6%9C%BA%E6%8A%95%E9%80%92%E6%8E%A7%E5%88%B6%E6%9C%A8%E9%A9%AC%EF%BC%8C%E7%AA%83%E5%8F%96%E8%AF%A5%E5%85%AC%E5%8F%B8%E5%A4%A7%E9%87%8F%E5%95%86%E4%B8%9A%E7%A7%98%E5%AF%86%E4%BF%A1%E6%81%AF%E5%92%8C%E7%9F%A5%E8%AF%86%E4%BA%A7%E6%9D%83%E3%80%82%202023%E5%B9%B45%E6%9C%88%E8%B5%B7%EF%BC%8C%E6%88%91%E5%9B%BD%E6%9F%90%E6%99%BA%E6%85%A7%E8%83%BD%E6%BA%90%E5%92%8C%E6%95%B0%E5%AD%97%E4%BF%A1%E6%81%AF%E5%A4%A7%E5%9E%8B%E9%AB%98%E7%A7%91%E6%8A%80%E4%BC%81%E4%B8%9A%E9%81%AD%E7%96%91%E4%BC%BC%E7%BE%8E%E5%9B%BD%E6%83%85%E6%8A%A5%E6%9C%BA%E6%9E%84%E7%BD%91%E7%BB%9C%E6%94%BB%E5%87%BB%E3%80%82%20%E7%BB%8F%E5%88%86%E6%9E%90%EF%BC%8C%E6%94%BB%E5%87%BB%E8%80%85%E4%BD%BF%E7%94%A8%E5%A4%9A%E4%B8%AA%E5%A2%83%E5%A4%96%E8%B7%B3%E6%9D%BF%EF%BC%8C%E5%88%A9%E7%94%A8%E5%BE%AE%E8%BD%AFExchange%E6%BC%8F%E6%B4%9E%EF%BC%8C%E5%85%A5%E4%BE%B5%E6%8E%A7%E5%88%B6%E8%AF%A5%E5%85%AC%E5%8F%B8%E9%82%AE%E4%BB%B6%E6%9C%8D%E5%8A%A1%E5%99%A8%E5%B9%B6%E6%A4%8D%E5%85%A5%E5%90%8E%E9%97%A8%E7%A8%8B%E5%BA%8F%EF%BC%8C%E6%8C%81%E7%BB%AD%E7%AA%83%E5%8F%96%E9%82%AE%E4%BB%B6%E6%95%B0%E6%8D%AE%E3%80%82",Unknown,International power,China – USA,Yes / HIIK intensity,HIIK 2,1,18.12.2024,Not available,Not available,China,National Computer Network Emergency Response Technical Team/Coordination Center of China (CNCERT) (China),Unknown,Not available,Exploit Public-Facing Application,Data Exfiltration,Not available,False,For private / commercial targets: sensitive information (incident scores 2 points in intensity),Not available,"Hijacking, system misuse, e.g., through data theft and / or disruption (incident scores 2 points in intensity)",none,none,4,Moderate - high political importance,4,Low,6,No system interference/disruption,"Minor data breach/exfiltration (no critical/sensitive information), but no data corruption (deletion/altering) or leaking of data  ",1-10,2,1-10,1,None,0,euro,Direct (official members of state entities / agencies / units responsible),Cyber espionage;Sovereignty,State actors;Not available,Not available,0,Not available,Not available,Not available,Not available,Not available,Not available,Not available,Countermeasures under international law justified (state-atttribution & breach of international law),Not available,"https://cyberscoop.com/chinese-cyber-center-us-alleged-cyberattacks-trade-secrets/;https://www.cert.org.cn/publish/main/49/2024/20241218184234131217571/20241218184234131217571_.html#:~:text=%E5%9B%BD%E5%AE%B6%E4%BA%92%E8%81%94%E7%BD%91%E5%BA%94%E6%80%A5%E4%B8%AD%E5%BF%83%E5%8F%91%E7%8E%B0%E5%A4%84%E7%BD%AE%E4%B8%A4%E8%B5%B7%E7%BE%8E%E5%AF%B9%E6%88%91%E5%A4%A7%E5%9E%8B%E7%A7%91%E6%8A%80%E4%BC%81%E4%B8%9A%E6%9C%BA%E6%9E%84%E8%BF%9B%E8%A1%8C%E7%BD%91%E7%BB%9C%E6%94%BB%E5%87%BB%E7%AA%83%E5%8F%96%E5%95%86%E4%B8%9A%E7%A7%98%E5%AF%86%E4%BA%8B%E4%BB%B6%E3%80%82%202024%E5%B9%B48%E6%9C%88%E8%B5%B7%EF%BC%8C%E6%88%91%E5%9B%BD%E6%9F%90%E5%85%88%E8%BF%9B%E6%9D%90%E6%96%99%E8%AE%BE%E8%AE%A1%E7%A0%94%E7%A9%B6%E5%8D%95%E4%BD%8D%E9%81%AD%E7%96%91%E4%BC%BC%E7%BE%8E%E5%9B%BD%E6%83%85%E6%8A%A5%E6%9C%BA%E6%9E%84%E7%BD%91%E7%BB%9C%E6%94%BB%E5%87%BB%E3%80%82,%E7%BB%8F%E5%88%86%E6%9E%90%EF%BC%8C%E6%94%BB%E5%87%BB%E8%80%85%E5%88%A9%E7%94%A8%E6%88%91%E5%A2%83%E5%86%85%E6%9F%90%E7%94%B5%E5%AD%90%E6%96%87%E6%A1%A3%E5%AE%89%E5%85%A8%E7%AE%A1%E7%90%86%E7%B3%BB%E7%BB%9F%E6%BC%8F%E6%B4%9E%EF%BC%8C%E5%85%A5%E4%BE%B5%E8%AF%A5%E5%85%AC%E5%8F%B8%E9%83%A8%E7%BD%B2%E7%9A%84%E8%BD%AF%E4%BB%B6%E5%8D%87%E7%BA%A7%E7%AE%A1%E7%90%86%E6%9C%8D%E5%8A%A1%E5%99%A8%EF%BC%8C%E9%80%9A%E8%BF%87%E8%BD%AF%E4%BB%B6%E5%8D%87%E7%BA%A7%E6%9C%8D%E5%8A%A1%E5%90%91%E8%AF%A5%E5%85%AC%E5%8F%B8%E7%9A%84270%E4%BD%99%E5%8F%B0%E4%B8%BB%E6%9C%BA%E6%8A%95%E9%80%92%E6%8E%A7%E5%88%B6%E6%9C%A8%E9%A9%AC%EF%BC%8C%E7%AA%83%E5%8F%96%E8%AF%A5%E5%85%AC%E5%8F%B8%E5%A4%A7%E9%87%8F%E5%95%86%E4%B8%9A%E7%A7%98%E5%AF%86%E4%BF%A1%E6%81%AF%E5%92%8C%E7%9F%A5%E8%AF%86%E4%BA%A7%E6%9D%83%E3%80%82%202023%E5%B9%B45%E6%9C%88%E8%B5%B7%EF%BC%8C%E6%88%91%E5%9B%BD%E6%9F%90%E6%99%BA%E6%85%A7%E8%83%BD%E6%BA%90%E5%92%8C%E6%95%B0%E5%AD%97%E4%BF%A1%E6%81%AF%E5%A4%A7%E5%9E%8B%E9%AB%98%E7%A7%91%E6%8A%80%E4%BC%81%E4%B8%9A%E9%81%AD%E7%96%91%E4%BC%BC%E7%BE%8E%E5%9B%BD%E6%83%85%E6%8A%A5%E6%9C%BA%E6%9E%84%E7%BD%91%E7%BB%9C%E6%94%BB%E5%87%BB%E3%80%82%20%E7%BB%8F%E5%88%86%E6%9E%90%EF%BC%8C%E6%94%BB%E5%87%BB%E8%80%85%E4%BD%BF%E7%94%A8%E5%A4%9A%E4%B8%AA%E5%A2%83%E5%A4%96%E8%B7%B3%E6%9D%BF%EF%BC%8C%E5%88%A9%E7%94%A8%E5%BE%AE%E8%BD%AFExchange%E6%BC%8F%E6%B4%9E%EF%BC%8C%E5%85%A5%E4%BE%B5%E6%8E%A7%E5%88%B6%E8%AF%A5%E5%85%AC%E5%8F%B8%E9%82%AE%E4%BB%B6%E6%9C%8D%E5%8A%A1%E5%99%A8%E5%B9%B6%E6%A4%8D%E5%85%A5%E5%90%8E%E9%97%A8%E7%A8%8B%E5%BA%8F%EF%BC%8C%E6%8C%81%E7%BB%AD%E7%AA%83%E5%8F%96%E9%82%AE%E4%BB%B6%E6%95%B0%E6%8D%AE%E3%80%82",2024-12-20,2025-02-18
4159,Unspecified US intelligence agency stole trade secrets from an unnamed Chinese advanced materials design and research since at least August 2024,"The Chinese National Internet Emergency Response Center (CNCERT) reported two cyberattacks on December 18, 2024, involving the theft of trade secrets by the United States.
In the first cyber incident, a Chinese advanced materials design and research unit has allegedly been targeted by U.S. intelligence agencies since August 2024. The attackers exploited a vulnerability in an electronic document security management system, compromising the company's software upgrade management server. Through this breach, they delivered control Trojans to over 270 company hosts via the software upgrade service, stealing significant amounts of trade secret information and intellectual property.",01.08.2024,Not available,"Attack conducted by nation state (generic “state-attribution” or direct attribution towards specific state-entities, e.g., intelligence agencies);Attack on critical infrastructure target(s)",Not available;Not available,Incident disclosed by authorities of victim state,Data theft;Hijacking with Misuse,Not available;Not available,China;China,CN;CN,"['ASIA', 'SCS', 'EASIA', 'NEA', 'SCO'];['ASIA', 'SCS', 'EASIA', 'NEA', 'SCO']",Corporate Targets (corporate targets only coded if the respective company is not part of the critical infrastructure definition);Critical infrastructure,Not available;Research,Unknown,United States,US,State,Not available,1,25489,18.12.2024,"Political statement / report (e.g., on government / state agency websites)",Attribution by receiver government / state entity,CNCERT,Not available,China,True,United States,State,"https://www.cert.org.cn/publish/main/49/2024/20241218184234131217571/20241218184234131217571_.html#:~:text=%E5%9B%BD%E5%AE%B6%E4%BA%92%E8%81%94%E7%BD%91%E5%BA%94%E6%80%A5%E4%B8%AD%E5%BF%83%E5%8F%91%E7%8E%B0%E5%A4%84%E7%BD%AE%E4%B8%A4%E8%B5%B7%E7%BE%8E%E5%AF%B9%E6%88%91%E5%A4%A7%E5%9E%8B%E7%A7%91%E6%8A%80%E4%BC%81%E4%B8%9A%E6%9C%BA%E6%9E%84%E8%BF%9B%E8%A1%8C%E7%BD%91%E7%BB%9C%E6%94%BB%E5%87%BB%E7%AA%83%E5%8F%96%E5%95%86%E4%B8%9A%E7%A7%98%E5%AF%86%E4%BA%8B%E4%BB%B6%E3%80%82%202024%E5%B9%B48%E6%9C%88%E8%B5%B7%EF%BC%8C%E6%88%91%E5%9B%BD%E6%9F%90%E5%85%88%E8%BF%9B%E6%9D%90%E6%96%99%E8%AE%BE%E8%AE%A1%E7%A0%94%E7%A9%B6%E5%8D%95%E4%BD%8D%E9%81%AD%E7%96%91%E4%BC%BC%E7%BE%8E%E5%9B%BD%E6%83%85%E6%8A%A5%E6%9C%BA%E6%9E%84%E7%BD%91%E7%BB%9C%E6%94%BB%E5%87%BB%E3%80%82,%E7%BB%8F%E5%88%86%E6%9E%90%EF%BC%8C%E6%94%BB%E5%87%BB%E8%80%85%E5%88%A9%E7%94%A8%E6%88%91%E5%A2%83%E5%86%85%E6%9F%90%E7%94%B5%E5%AD%90%E6%96%87%E6%A1%A3%E5%AE%89%E5%85%A8%E7%AE%A1%E7%90%86%E7%B3%BB%E7%BB%9F%E6%BC%8F%E6%B4%9E%EF%BC%8C%E5%85%A5%E4%BE%B5%E8%AF%A5%E5%85%AC%E5%8F%B8%E9%83%A8%E7%BD%B2%E7%9A%84%E8%BD%AF%E4%BB%B6%E5%8D%87%E7%BA%A7%E7%AE%A1%E7%90%86%E6%9C%8D%E5%8A%A1%E5%99%A8%EF%BC%8C%E9%80%9A%E8%BF%87%E8%BD%AF%E4%BB%B6%E5%8D%87%E7%BA%A7%E6%9C%8D%E5%8A%A1%E5%90%91%E8%AF%A5%E5%85%AC%E5%8F%B8%E7%9A%84270%E4%BD%99%E5%8F%B0%E4%B8%BB%E6%9C%BA%E6%8A%95%E9%80%92%E6%8E%A7%E5%88%B6%E6%9C%A8%E9%A9%AC%EF%BC%8C%E7%AA%83%E5%8F%96%E8%AF%A5%E5%85%AC%E5%8F%B8%E5%A4%A7%E9%87%8F%E5%95%86%E4%B8%9A%E7%A7%98%E5%AF%86%E4%BF%A1%E6%81%AF%E5%92%8C%E7%9F%A5%E8%AF%86%E4%BA%A7%E6%9D%83%E3%80%82%202023%E5%B9%B45%E6%9C%88%E8%B5%B7%EF%BC%8C%E6%88%91%E5%9B%BD%E6%9F%90%E6%99%BA%E6%85%A7%E8%83%BD%E6%BA%90%E5%92%8C%E6%95%B0%E5%AD%97%E4%BF%A1%E6%81%AF%E5%A4%A7%E5%9E%8B%E9%AB%98%E7%A7%91%E6%8A%80%E4%BC%81%E4%B8%9A%E9%81%AD%E7%96%91%E4%BC%BC%E7%BE%8E%E5%9B%BD%E6%83%85%E6%8A%A5%E6%9C%BA%E6%9E%84%E7%BD%91%E7%BB%9C%E6%94%BB%E5%87%BB%E3%80%82%20%E7%BB%8F%E5%88%86%E6%9E%90%EF%BC%8C%E6%94%BB%E5%87%BB%E8%80%85%E4%BD%BF%E7%94%A8%E5%A4%9A%E4%B8%AA%E5%A2%83%E5%A4%96%E8%B7%B3%E6%9D%BF%EF%BC%8C%E5%88%A9%E7%94%A8%E5%BE%AE%E8%BD%AFExchange%E6%BC%8F%E6%B4%9E%EF%BC%8C%E5%85%A5%E4%BE%B5%E6%8E%A7%E5%88%B6%E8%AF%A5%E5%85%AC%E5%8F%B8%E9%82%AE%E4%BB%B6%E6%9C%8D%E5%8A%A1%E5%99%A8%E5%B9%B6%E6%A4%8D%E5%85%A5%E5%90%8E%E9%97%A8%E7%A8%8B%E5%BA%8F%EF%BC%8C%E6%8C%81%E7%BB%AD%E7%AA%83%E5%8F%96%E9%82%AE%E4%BB%B6%E6%95%B0%E6%8D%AE%E3%80%82",Unknown,International power,China – USA,Yes / HIIK intensity,HIIK 2,1,18.12.2024,Not available,Not available,China,National Computer Network Emergency Response Technical Team/Coordination Center of China (CNCERT) (China),Unknown,Not available,Exploit Public-Facing Application,Data Exfiltration,Not available,False,For private / commercial targets: sensitive information (incident scores 2 points in intensity),Not available,"Hijacking, system misuse, e.g., through data theft and / or disruption (incident scores 2 points in intensity)",none,none,4,Moderate - high political importance,4,Low,6,No system interference/disruption,"Minor data breach/exfiltration (no critical/sensitive information), but no data corruption (deletion/altering) or leaking of data  ",1-10,0,1-10,1,None,0,euro,Direct (official members of state entities / agencies / units responsible),Cyber espionage;Sovereignty,State actors;Not available,Not available,0,Not available,Not available,Not available,Not available,Not available,Not available,Not available,Countermeasures under international law justified (state-atttribution & breach of international law),Not available,"https://cyberscoop.com/chinese-cyber-center-us-alleged-cyberattacks-trade-secrets/;https://www.cert.org.cn/publish/main/49/2024/20241218184234131217571/20241218184234131217571_.html#:~:text=%E5%9B%BD%E5%AE%B6%E4%BA%92%E8%81%94%E7%BD%91%E5%BA%94%E6%80%A5%E4%B8%AD%E5%BF%83%E5%8F%91%E7%8E%B0%E5%A4%84%E7%BD%AE%E4%B8%A4%E8%B5%B7%E7%BE%8E%E5%AF%B9%E6%88%91%E5%A4%A7%E5%9E%8B%E7%A7%91%E6%8A%80%E4%BC%81%E4%B8%9A%E6%9C%BA%E6%9E%84%E8%BF%9B%E8%A1%8C%E7%BD%91%E7%BB%9C%E6%94%BB%E5%87%BB%E7%AA%83%E5%8F%96%E5%95%86%E4%B8%9A%E7%A7%98%E5%AF%86%E4%BA%8B%E4%BB%B6%E3%80%82%202024%E5%B9%B48%E6%9C%88%E8%B5%B7%EF%BC%8C%E6%88%91%E5%9B%BD%E6%9F%90%E5%85%88%E8%BF%9B%E6%9D%90%E6%96%99%E8%AE%BE%E8%AE%A1%E7%A0%94%E7%A9%B6%E5%8D%95%E4%BD%8D%E9%81%AD%E7%96%91%E4%BC%BC%E7%BE%8E%E5%9B%BD%E6%83%85%E6%8A%A5%E6%9C%BA%E6%9E%84%E7%BD%91%E7%BB%9C%E6%94%BB%E5%87%BB%E3%80%82,%E7%BB%8F%E5%88%86%E6%9E%90%EF%BC%8C%E6%94%BB%E5%87%BB%E8%80%85%E5%88%A9%E7%94%A8%E6%88%91%E5%A2%83%E5%86%85%E6%9F%90%E7%94%B5%E5%AD%90%E6%96%87%E6%A1%A3%E5%AE%89%E5%85%A8%E7%AE%A1%E7%90%86%E7%B3%BB%E7%BB%9F%E6%BC%8F%E6%B4%9E%EF%BC%8C%E5%85%A5%E4%BE%B5%E8%AF%A5%E5%85%AC%E5%8F%B8%E9%83%A8%E7%BD%B2%E7%9A%84%E8%BD%AF%E4%BB%B6%E5%8D%87%E7%BA%A7%E7%AE%A1%E7%90%86%E6%9C%8D%E5%8A%A1%E5%99%A8%EF%BC%8C%E9%80%9A%E8%BF%87%E8%BD%AF%E4%BB%B6%E5%8D%87%E7%BA%A7%E6%9C%8D%E5%8A%A1%E5%90%91%E8%AF%A5%E5%85%AC%E5%8F%B8%E7%9A%84270%E4%BD%99%E5%8F%B0%E4%B8%BB%E6%9C%BA%E6%8A%95%E9%80%92%E6%8E%A7%E5%88%B6%E6%9C%A8%E9%A9%AC%EF%BC%8C%E7%AA%83%E5%8F%96%E8%AF%A5%E5%85%AC%E5%8F%B8%E5%A4%A7%E9%87%8F%E5%95%86%E4%B8%9A%E7%A7%98%E5%AF%86%E4%BF%A1%E6%81%AF%E5%92%8C%E7%9F%A5%E8%AF%86%E4%BA%A7%E6%9D%83%E3%80%82%202023%E5%B9%B45%E6%9C%88%E8%B5%B7%EF%BC%8C%E6%88%91%E5%9B%BD%E6%9F%90%E6%99%BA%E6%85%A7%E8%83%BD%E6%BA%90%E5%92%8C%E6%95%B0%E5%AD%97%E4%BF%A1%E6%81%AF%E5%A4%A7%E5%9E%8B%E9%AB%98%E7%A7%91%E6%8A%80%E4%BC%81%E4%B8%9A%E9%81%AD%E7%96%91%E4%BC%BC%E7%BE%8E%E5%9B%BD%E6%83%85%E6%8A%A5%E6%9C%BA%E6%9E%84%E7%BD%91%E7%BB%9C%E6%94%BB%E5%87%BB%E3%80%82%20%E7%BB%8F%E5%88%86%E6%9E%90%EF%BC%8C%E6%94%BB%E5%87%BB%E8%80%85%E4%BD%BF%E7%94%A8%E5%A4%9A%E4%B8%AA%E5%A2%83%E5%A4%96%E8%B7%B3%E6%9D%BF%EF%BC%8C%E5%88%A9%E7%94%A8%E5%BE%AE%E8%BD%AFExchange%E6%BC%8F%E6%B4%9E%EF%BC%8C%E5%85%A5%E4%BE%B5%E6%8E%A7%E5%88%B6%E8%AF%A5%E5%85%AC%E5%8F%B8%E9%82%AE%E4%BB%B6%E6%9C%8D%E5%8A%A1%E5%99%A8%E5%B9%B6%E6%A4%8D%E5%85%A5%E5%90%8E%E9%97%A8%E7%A8%8B%E5%BA%8F%EF%BC%8C%E6%8C%81%E7%BB%AD%E7%AA%83%E5%8F%96%E9%82%AE%E4%BB%B6%E6%95%B0%E6%8D%AE%E3%80%82",2024-12-20,2025-02-18
