4082,The Termite ransomware group disrupted the managed services hosted environment of supply chain management and software provider Blue Yonder since at least 21 November 2024,"The Termite ransomware group disrupted the managed services hosted environment of supply chain management and software provider Blue Yonder since at least 21 November 2024, Blue Yonder reported in an incident notification for the first time on 22 November 2024.
The incident involved a ransomware attack, and at least at the coffee chain Starbucks, the incident disrupted the system they use to track and manage their employees' schedules. The retailer Wm Morrison Supermarkets was also affected. In December 2024, the Termite ransomware group claimed to have exfiltrated 680 GB of data, including databases, email lists ""for future attacks"" (over 16,000 entries), miscellaneous documents (over 200,000), reports, and insurance documents.
On January 29, 2025, Morrisons supermarkets reported that the cyberattack on its technology supplier, Blue Yonder, in November disrupted product availability and impacted Christmas sales. CEO Rami Baitieh explained that the attack forced the shutdown of the company’s warehouse management system, resulting in a temporary loss of visibility over fresh produce and fruit and vegetable stock levels.",21.11.2024,21.11.2024,Attack on critical infrastructure target(s),Not available,Incident disclosed by victim,Data theft;Hijacking with Misuse;Ransomware,Blue Yonder,United States,US,"['NATO', 'NORTHAM']",Critical infrastructure,Telecommunications,Termite ransomware,Unknown,Unknown,Non-state-group,Criminal(s),1,25051,01.12.2024,"Direct statement in media report (e.g., Reuters article cites the attribution statements by a person) / self-attribution via social media",Attacker confirms,Termite ransomware,Not available,Not available,True,Unknown,Non-state-group,Not available,Not available,Not available,Not available,Not available,Not available,0,Not available,Not available,Not available,Not available,Not available,Not available,Not available,Not available,Data Exfiltration,Not available,False,For private / commercial targets: non-sensitive information (incident scores 1 point in intensity),Not available,"Hijacking, system misuse, e.g., through data theft and / or disruption (incident scores 2 points in intensity)",none,none,3,Moderate - high political importance,3,Low,6,No system interference/disruption,"Minor data breach/exfiltration (no critical/sensitive information), but no data corruption (deletion/altering) or leaking of data  ",1-10,1,1-10,1,None,0,euro,None/Negligent,Human rights;Due diligence;Sovereignty,Civic / political rights;Not available;Not available,Not available,0,Not available,Not available,Not available,Not available,Not available,Not available,Not available,Unfriendly acts/retorsions justified (missing state-attribution & breach ofinternational law OR state-attribution & missing breach of international law),Not available,https://securityaffairs.com/171434/uncategorized/blue-yonder-ransomware-attack.html;https://edition.cnn.com/2024/11/25/tech/starbucks-ransomware-attack/index.html;https://blueyonder.com/customer-update;https://www.computerworld.dk/art/289558/global-software-udbyder-ramt-af-nedbrud-starbucks-har-problemer-med-at-udbetale-loen;https://www.mirror.co.uk/money/morrisons-shoppers-fume-after-cyber-34189321;https://www.it-daily.net/shortnews/hackerangriff-auf-software-anbieter-laehmt-starbucks-systeme;https://www.cnbctv18.com/technology/starbucks-ransomware-attack-vendor-blue-yonder-cyber-insurance-coffee-giant-operations-19515081.htm;https://www.inside-it.ch/cyberangriff-auf-software-anbieter-blue-yonder-beeintraechtigt-grosse-detailhaendler-20241126;https://hackread.com/starbucks-ransomware-attack-on-contractor/;https://www.siliconrepublic.com/enterprise/blue-yonder-cybersecurity-ransomware-cyberattack-tesco-sainsburys-supply-chain;https://www.cyberdaily.au/security/11420-exclusive-auspost-confirms-not-affected-by-global-third-party-supply-chain-attack;https://www.heise.de/en/news/Starbucks-affected-by-cyber-attack-on-software-provider-10177831.html;https://motortransport.co.uk/operator-news/blue-yonder-cyber-attack-hits-morrisons-and-sainsburys-supply-chains/25026.article;https://www.heise.de/news/Mittwoch-Starbucks-leidet-unter-Cyberangriff-Huawei-Smartphones-mit-neuem-Chip-10177883.html;https://www.lemondeinformatique.fr/actualites/lire-starbucks-perturbe-par-une-attaque-ransomware-sur-un-fournisseur-tiers-95389.html;https://www.techrepublic.com/article/blue-yonder-ransomware-attack/;https://www.retaildetail.be/fr/news/general/une-cyberattaque-frappe-grand-nombre-de-distributeurs-de-hema-a-starbucks/;https://www.usine-digitale.fr/article/plusieurs-grandes-societes-au-ralenti-apres-une-cyberattaque-contre-un-logiciel-de-supply-chain.N2223448;https://research.checkpoint.com/2024/2nd-december-threat-intelligence-report/;https://www.computerweekly.com/de/news/366616425/Die-Cyberangriffe-der-KW48-2024-im-Ueberblick;https://www.thegrocer.co.uk/news/morrisons-builds-new-warehouse-management-system-after-blue-yonder-cyberattack/698546.article;https://thestrayferret.co.uk/news/latest/morrisons-explains-reason-for-empty-shelves-at-local-supermarkets;https://www.cyberdaily.au/security/11465-new-ransomware-gang-claims-blue-yonder-cyber-attack;https://cyberscoop.com/termite-ransomware-blue-yonder-disruption/;https://www.thegrocer.co.uk/news/blue-yonder-tells-supermarkets-data-is-safe-after-group-claims-credit-for-ransomware-attack/699582.article;https://www.zonebourse.com/actualite-bourse/Le-groupe-britannique-Morrisons-declare-qu-une-cyberattaque-contre-un-fournisseur-de-technologie-a-48900387/,2024-11-27,2025-01-30
4081,Unknown threat actors compromised the company network of Maxar Space Systems on 4 October 2024,"On 4 October 2024, Hackers breached U.S. satellite maker Maxar Space Systems and accessed personal data belonging to its employees, including name, social security number and the employee number. The company informs in a notification to impacted individuals. On 11 October 2024, immediately after discovering the unauthorized access, the company took action to prevent the hackers from reaching further into the system. The company said: “Our information security team discovered that a hacker using a Hong Kong-based IP address targeted and accessed a Maxar system containing certain files with employee personal data.”",04.10.2024,11.10.2024,Attack on critical infrastructure target(s),Not available,Incident disclosed by victim,Data theft;Hijacking with Misuse,Maxar Technologies;Maxar Technologies,United States;United States,US;US,"['NATO', 'NORTHAM'];['NATO', 'NORTHAM']",Critical infrastructure;Critical infrastructure,Space;Critical Manufacturing,Not attributed,Not attributed,Not attributed,Not attributed,Not available,1,24537,Not available,Not available,Not available,Not available,Not available,Not available,True,Not attributed,Not attributed,Not available,Unknown,Unknown,Not available,Unknown,Not available,0,Not available,Not available,Not available,Not available,Not available,Not available,Not available,Not available,Not available,Not available,False,For private / commercial targets: non-sensitive information (incident scores 1 point in intensity),Not available,"Hijacking, system misuse, e.g., through data theft and / or disruption (incident scores 2 points in intensity)",none,none,3,Moderate - high political importance,3,Low,6,No system interference/disruption,"Minor data breach/exfiltration (no critical/sensitive information), but no data corruption (deletion/altering) or leaking of data  ",1-10,1,1-10,1,None,0,euro,Not available,Cyber espionage;Human rights;Sovereignty,Non-state actors;Civic / political rights;Not available,Not available,1,2024-11-19,"Other legal measures on national level (e.g. law enforcement investigations, arrests)",Not available,United States,Not available,Not available,Not available,Unfriendly acts/retorsions justified (missing state-attribution & breach ofinternational law OR state-attribution & missing breach of international law),Not available,https://research.checkpoint.com/2024/25th-november-threat-intelligence-report/;https://s3.documentcloud.org/documents/25336013/maxar-adult-ca-sample-ltr_redacted.pdf;https://www.bleepingcomputer.com/news/security/us-space-tech-giant-maxar-discloses-employee-data-breach/;https://cybersecuritynews.com/maxar-space-systems-suffers-data-breach/;https://cyberscoop.com/blue-yonder-ransomware-impact-starbucks-supermarkets/,2024-11-26,2024-12-30
4080,Russian state-sponsored hacking group GruesomeLarch (also known as APT 28) breached an unknown organization in the United States by exploiting neighboring Wi-Fi networks in February 2022,"In 2022, Russian state-sponsored hackers, specifically Unit 26165 of the 85th Main Special Services Center, also known as APT 28, Forest Blizzard, Fancy Bear and GruesomeLarch, breached a Washington, D.C.-based organization, named Organization A in Volexity's report, focused on Ukraine by exploiting Wi-Fi connectivity, using a new attack technique dubbed a 'nearest neighbour attack'. The attackers initially attempted a password-spray attack against a public entry point but were hampered by a multi-factor authentication requirement. They then compromised at least two nearby organization's networks, named Organisations B and C in Volexity's report, using credentials originating from a password-spray attack in January and February 2022. Starting from these two organizations close to the actual target, they connected to the victim's Wi-Fi network, as the target's Wi-Fi system didn't require multi-factor authentication. Volexity detected the hacking campaign on 4 February 2022, when hackers began exfiltrating data through compressed files, using Microsoft's native Cipher.exe utility to evade detection. Following Volexity's initial comprehensive analysis and countermeasures at an unspecified point, Volexity discovered that the hackers could reaccess Organisation C's network approximately one month after the initial countermeasures.
The breach was first reported at the 2024 Cyberwarcon conference in Arlington, Virginia, and was disclosed by Steven Adair, a researcher and the president of Volexity and Ars Technica, on 22 November 2024. 
The attackers claimed no responsibility for the incident.",01.01.2022,Not available,"Attack conducted by non-state group / non-state actor with political goals (religious, ethnic, etc. groups) / undefined actor with political goals","Attack conducted by a state-affiliated group (includes state-sanctioned, state-supported, state-controlled but officially non-state actors) (“cyber-proxies”) / a group that is generally attributed as state-affiliated ",Incident disclosed by IT-security company,Data theft;Hijacking with Misuse,Not available,United States,US,"['NATO', 'NORTHAM']",Unknown,Not available,"Fancy Bear/APT28/Sofacy/Pawn Storm/Group 74/Sednit/Tsar Team/Forest Blizzard fka STRONTIUM/Grizzly Steppe/SNAKEMACKEREL/IRON TWILIGHT/TG-4127/Group G0007/ITG05/BlueDelta (GRU, 85th Main Special Service Center (GTsSS) Military Unit 26165)",Russia,RU,State affiliated actor,"Non-state-group, state-affiliation suggested (widely held view for the attributed initiator (group), but not invoked in this case)",1,24538,22.11.2024,"Technical report (e.g., by IT-companies, Citizen Lab, EFF)",IT-security community attributes attacker,Volexity,Volexity,United States,True,Russia,State affiliated actor,https://www.volexity.com/blog/2024/11/22/the-nearest-neighbor-attack-how-a-russian-apt-weaponized-nearby-wi-fi-networks-for-covert-access/,International power;Cyber-specific,International power,"EU, USA et. al –  Russia",Yes / HIIK intensity,HIIK 3,0,Not available,Not available,Not available,Not available,Not available,Not available,Not available,Exploit Public-Facing Application,Data Exfiltration,None,False,For private / commercial targets: non-sensitive information (incident scores 1 point in intensity),Not available,"Hijacking, system misuse, e.g., through data theft and / or disruption (incident scores 2 points in intensity)",none,none,3,Moderate - high political importance,3,Low,6,No system interference/disruption,"Minor data breach/exfiltration (no critical/sensitive information), but no data corruption (deletion/altering) or leaking of data  ",1-10,1,1-10,1,None,0,euro,Indirect (knowingly sanctioning / ordering / ideological / material support by official members of state entities/agencies/units for officially non-state-actors),Cyber espionage;Human rights;Sovereignty,Non-state actors;Civic / political rights;Not available,Not available,0,Not available,Not available,Not available,Not available,Not available,Not available,Not available,Countermeasures under international law justified (state-atttribution & breach of international law),Not available,https://www.techtimes.com/articles/308421/20241123/elite-russian-hackers-use-neighbors-wi-fi-spy-game-masterpiece.htm;https://www.govinfosecurity.com/russian-hackers-exploit-wifi-in-sophisticated-new-attack-a-26901;https://www.volexity.com/blog/2024/11/22/the-nearest-neighbor-attack-how-a-russian-apt-weaponized-nearby-wi-fi-networks-for-covert-access/,2024-11-26,2025-02-27
4079,Near2tlg gained access into the extranet of the HR department of the Bank of France,"The Bank of France was allegedly breached by the Near2tlg hacker group, who claim to have stolen sensitive data, including employee identities, customer bank accounts and transaction history, internal reports, financial strategies, and confidential communications, which were put up for sale on Telegram and BreachForums for $10,000, with sample documents including position papers and administrative reports on 23 November 2024. However, the full scope of the intrusion remains unclear. On Monday, 25 November, the communications department of the Banque de France told Ouest-France that “there was no attack on the secure information system”. However, the Banque de France acknowledges that “there was occasional external access to an HR (human resources) extranet. But no sensitive personal or financial data was compromised”. The institution has closed the extranet site affected by this cybercriminal visit.",23.11.2024,23.11.2024,Attack on critical infrastructure target(s),Not available,Incident disclosed by attacker,Data theft & Doxing;Hijacking with Misuse,Bank of France,France,FR,"['EUROPE', 'NATO', 'EU', 'WESTEU']",Critical infrastructure,Finance,Near2tlg,Unknown,Unknown,Non-state-group,Criminal(s),1,24539,23.11.2024,"Direct statement in media report (e.g., Reuters article cites the attribution statements by a person) / self-attribution via social media",Attacker confirms,Near2tlg,Not available,Not available,True,Unknown,Non-state-group,https://www.ouest-france.fr/societe/cyberattaque/la-banque-de-france-dement-avoir-subi-une-cyberattaque-sur-le-systeme-dinformation-securise-d246622a-ab54-11ef-8248-4f6efd927e57,Not available,Not available,Not available,Not available,Not available,1,25.11.2024,State Actors: Stabilizing measures,Subnational executive official,France,Bank of France (France),No,Not available,Not available,Not available,Not available,False,For private / commercial targets: non-sensitive information (incident scores 1 point in intensity),Not available,"Hijacking, system misuse, e.g., through data theft and / or disruption (incident scores 2 points in intensity)",none,none,3,Moderate - high political importance,3,Low,8,No system interference/disruption,"Minor data breach/exfiltration (no critical/sensitive information), data corruption (deletion/altering) and/or leaking of data  ",1-10,1,Not available,0,None,0,euro,None/Negligent,Human rights;Due diligence;Sovereignty,Civic / political rights;Not available;Not available,Not available,0,Not available,Not available,Not available,Not available,Not available,Not available,Not available,Unfriendly acts/retorsions justified (missing state-attribution & breach ofinternational law OR state-attribution & missing breach of international law),Not available,https://www.nlto.fr/Cybersecurite-des-donnees-de-la-Banque-de-France-seraient-en-danger_a5220.html;https://www.clubic.com/actualite-544949-piratage-de-donnees-ce-serait-carrement-au-tour-de-la-banque-de-france-d-avoir-une-fuite.html;https://www.ouest-france.fr/societe/cyberattaque/la-banque-de-france-dement-avoir-subi-une-cyberattaque-sur-le-systeme-dinformation-securise-d246622a-ab54-11ef-8248-4f6efd927e57;https://www.usine-digitale.fr/article/cybersecurite-la-banque-de-france-reconnait-une-intrusion-mais-dement-une-fuite-de-donnees.N2223318;https://www.journaldeleconomie.fr/piratage-a-la-banque-de-france-deni-officiel-et-mysteres-persistants/,2024-11-26,2024-12-30
4076,Unknown threat actors carried out a DDDos-attack against Swiss website provider Backslash affecting cantons and towns in Switzerland on 24 November 2024,"On 24 November 2024, Unknown Threat Actors carried out a DDOS cyber attack on Backslash, a Swiss website provider. The attack resulted in 318 communal websites and the websites of the cantons of Schwyz and Glarus being inaccessible, including those of 68 municipalities in the canton of Aargau. The Federal Office for Cybersecurity BACS reported that there was no evidence of an infringement of the integrity or confidentiality of data of the authorities and municipalities concerned. The attack had no influence on the transmission of the voting results from the municipalities to the canton, following referenda held on that day. ",24.11.2024,24.11.2024,"Attack on (inter alia) political target(s), not politicized;Attack on critical infrastructure target(s)",Not available;Not available,Not available,Disruption,Canton of Schwyz;Backslash;Municipalities in the canton of Aargau;Canton of Glarus,Switzerland;Switzerland;Switzerland;Switzerland,CH;CH;CH;CH,"['EUROPE', 'WESTEU'];['EUROPE', 'WESTEU'];['EUROPE', 'WESTEU'];['EUROPE', 'WESTEU']",State institutions / political system;Critical infrastructure;State institutions / political system;State institutions / political system,Government / ministries;Digital Provider;Government / ministries;Government / ministries,Not attributed,Not attributed,Not attributed,Not attributed,Not available,1,24540,Not available,Not available,Not available,Not available,Not available,Not available,True,Not attributed,Not attributed,https://www.24heures.ch/piratage-de-nombreux-sites-internet-communaux-754773339195,Unknown,Unknown,Not available,Unknown,Not available,1,24.11.2024,Not available,Not available,Switzerland,Federal Office for Cybersecurity (BACS) (Switzerland),Not available,Not available,Not available,Network Denial of Service,Not available,True,Not available,Short-term disruption (< 24h; incident scores 1 point in intensity),Not available,none,none,1,Moderate - high political importance,1,Low,9,Day (< 24h),No data breach/exfiltration or data corruption (deletion/altering) and/or leaking of data,201-500,0,1-10,1,None,0,euro,Not available,Sovereignty,Not available,Not available,0,Not available,Not available,Not available,Not available,Not available,Not available,Not available,Unfriendly acts/retorsions justified (missing state-attribution & breach ofinternational law OR state-attribution & missing breach of international law),Not available,https://www.derbund.ch/abstimmungen-gemeinde-websites-nach-cyber-angriff-nicht-erreichbar-924314844880;https://www.nau.ch/news/schweiz/hacker-angriff-auf-aargauer-gemeinde-websites-66867874;https://www.24heures.ch/piratage-de-nombreux-sites-internet-communaux-754773339195;https://www.watson.ch/fr/suisse/cybercrime/244719918-des-sites-de-communes-et-de-cantons-suisses-paralyses;https://www.bernerzeitung.ch/abstimmungen-gemeinde-websites-nach-cyber-angriff-nicht-erreichbar-924314844880;https://www.rts.ch/info/suisse/2024/article/une-attaque-informatique-bloque-les-sites-de-nombreuses-communes-de-suisse-alemanique-28704965.html;https://www.laliberte.ch/articles/suisse/piratage-de-nombreux-sites-internet-communaux-919909;https://www.limmattalerzeitung.ch/zentralschweiz/schwyz/schwyz-selbst-ein-anfaenger-haette-die-internet-attacke-geschafft-ld.2706191,2024-11-25,2024-12-30
4075,Unknown threat actors breached and blocked computer systems of Occitanie’s agricultural chambers in mid-November 2024,"In mid-november 2024, unknown threat actors launched a cyber attack against Occitanie’s agricultural chambers, resulting in data theft and encryption of computer systems. The attack was disclosed to the public on 21 November 2024 with the Chamber stating that the situation was under control and that partially operations were already possible. The National Information Systems Directorate (DNSI) and the National Information Systems Security Agency (ANSSI) are working to restore all services as soon as possible. The Chamber has lodged a complaint with the authorities. The incidents bears similarities to an incident which affected the departmental chamber of Haute-Garonne.",18.11.2024,Not available,Attack on critical infrastructure target(s),Not available,Incident disclosed by authorities of victim state,Data theft;Disruption,Occitane Chamber of Agriculture,France,FR,"['EUROPE', 'NATO', 'EU', 'WESTEU']",Critical infrastructure,Not available,Not attributed,Not attributed,Not attributed,Not attributed,Not available,1,24541,Not available,Not available,Not available,Not available,Not available,Not available,True,Not attributed,Not attributed,Not available,Unknown,Unknown,Not available,Unknown,Not available,1,01.11.2024,State Actors: Stabilizing measures,Not available,France,National Information Systems Security Agency (ANSSI) (France),Not available,Not available,Not available,Data Exfiltration,Not available,True,For private / commercial targets: non-sensitive information (incident scores 1 point in intensity),Long-term disruption (> 24h; incident scores 2 points in intensity),Not available,none,none,3,Moderate - high political importance,3,Low,8,Days (< 7 days),"Minor data breach/exfiltration (no critical/sensitive information), but no data corruption (deletion/altering) or leaking of data  ",1-10,1,Not available,0,None,0,euro,Not available,Human rights;Sovereignty,Civic / political rights;Not available,Not available,0,Not available,Not available,Not available,Not available,Not available,Not available,Not available,Unfriendly acts/retorsions justified (missing state-attribution & breach ofinternational law OR state-attribution & missing breach of international law),Not available,https://www.ladepeche.fr/2024/11/23/cyberattaque-la-securite-maitrisee-12342306.php,2024-11-25,2024-12-30
4074,Unknown threat actors breached and encrypted the computer systems of Haute-Garonne Chamber of Agriculture in mid-November 2024,"Unknown threat actors breached the Haute-Garonne Chamber of Agriculture's information systems, stealing and encrypting data. The attack, which began 17 November 2024, was reported by the organization's president, Denis Carretier, and director, Jol Cassagne, who informed the public about the attack. The National Information Systems Directorate DNSI and the National Information Systems Security Agency ANSSI are working together to reestablish all services as soon as possible. A complaint has been lodged with the authorities. The incident coincided with another affecting the higher regional chamber of Occitane.",17.11.2024,Not available,"Attack on (inter alia) political target(s), not politicized;Attack on (inter alia) political target(s), not politicized;Attack on (inter alia) political target(s), not politicized",Not available;Not available;Not available,Incident disclosed by authorities of victim state,Data theft;Disruption;Hijacking with Misuse,Haut-Garonne Chamber of Agriculture;Haut-Garonne Chamber of Agriculture,France;France,FR;FR,"['EUROPE', 'NATO', 'EU', 'WESTEU'];['EUROPE', 'NATO', 'EU', 'WESTEU']",State institutions / political system;State institutions / political system,Civil service / administration;Civil service / administration,Not attributed,Not attributed,Not attributed,Not attributed,Not available,1,24542,Not available,Not available,Not available,Not available,Not available,Not available,True,Not attributed,Not attributed,Not available,Unknown,Unknown,Not available,Unknown,Not available,1,18.11.2024,State Actors: Stabilizing measures,Subnational executive official,France,National Information Systems Security Agency (ANSSI) (France),Not available,Not available,Not available,Data Exfiltration,Not available,True,For private / commercial targets: non-sensitive information (incident scores 1 point in intensity),Long-term disruption (> 24h; incident scores 2 points in intensity),"Hijacking, system misuse, e.g., through data theft and / or disruption (incident scores 2 points in intensity)",none,none,5,Moderate - high political importance,5,Low,8,Days (< 7 days),"Minor data breach/exfiltration (no critical/sensitive information), but no data corruption (deletion/altering) or leaking of data  ",1-10,1,Not available,0,None,0,euro,Not available,Human rights;Sovereignty,Civic / political rights;Not available,Not available,0,Not available,Not available,Not available,Not available,Not available,Not available,Not available,Unfriendly acts/retorsions justified (missing state-attribution & breach ofinternational law OR state-attribution & missing breach of international law),Not available,https://www.ladepeche.fr/2024/11/22/piratage-informatique-de-la-chambre-dagriculture-de-haute-garonne-la-situation-est-maitrisee-12340885.php,2024-11-25,2024-12-30
